url,content,summary
https://www.myscheme.gov.in/schemes/nssw,"New Swarnima Scheme For Women Are you sure you want to sign out? Cancel Sign Out | | Eng English / हिंदी Theme Sign In Back Details Benefits Eligibility Application Process Documents Required Frequently Asked Questions Sources And References Feedback Something went wrong. Please try again later. Ok You need to sign in before applying for schemes Cancel Sign In Something went wrong. Please try again later. Ok It seems you have already initiated your application earlier. To know more please visit Cancel Apply Now Check Eligibility New Swarnima Scheme For Women Ministry Of Social Justice and Empowerment Backward Class Business Empowerment Entrepreneur Financial Assistance Women Details A term loan scheme by the Ministry of Social Justice and Empowerment for women entrepreneurs from backward classes to obtain a loan of up to ₹2,00,000/- @ 5% per annum, thereby providing them social & financial security. The scheme is introduced by National Backward Classes Finance and Development Corporation (NBCFDC) and implemented by State Channelising Agencies (SCAs) which act as the nodal agency. Benefits A subsidy amount of ₹2,00,000/- @ 5% per annum, for self-employment. (The remaining amount has to be self-owned by the beneficiary.) The beneficiary woman is not required to invest any amount of her own on the projects upto cost of Rs.2,00,000/-. Eligibility The applicant must be a FEMALE . The age of the applicant must be between 18 and 55 years . The applicant must be an Entrepreneur The Total Annual Family Income of the Applicant must be Less than ₹ 3 Lakh per Annum Application Process Offline Step 1: Eligible applicant needs to visit nearest SCA office, apply on prescribed form for Swarnima Scheme for Women. You can find your nearest SCA office at this link - https://nsfdc.nic.in/channel-patrners/scas ﻿ Step 2: Enter the necessary details in the application form and mention the needs and choice of vocation and training requirements, if any. ﻿ Step 3: Submit your application form and the required documents to the same SCA office. After reviewing the application, the loan will be sanctioned by SCA. Documents Required Proof of Identity (Aadhaar card) Ration Card Domicile Certificate Caste Certificate (for reserved category) Passport size Photograph of the applicant Frequently Asked Questions What is the maximum size of the loan under the Swarnima Scheme? Under this scheme, the eligible woman entrepreneur can obtain a term loan of max. ₹1,00,000/- @ 5% per annum. What is the minimum amount that I am required to invest on my own if the project cost is under Rs.2 LPA? The beneficiary women is not required to invest any amount of her own on the projects upto cost of Rs.2,00,000/-. How much will be the interest rate for the loan? The rate of interest would be as follows - 
NBCFDC to SCA: 2% per annum
SCA to Beneficiary: 5% per annum By when am I expected to repay the loan? Loan is to be repaid in quarterly instalments with maximum 8 years (including the moratorium period of six months on the recovery of principal). I seek to know more about the Pattern of Financing? The loan will be provided up to 95% and balance 5% provided by the State Channelizing Agencies (SCAs) or Beneficiary contribution. The utilization period is 4 months from the date of disbursement of the loan. Can women entrepreneurs from GENERAL category also apply to this scheme? Yes, the scheme is open to women entrepreneurs from all the categories. I am a 21 years old female entrepreneur. I wish to know if there is an age-criteria to be eligible to apply to this scheme? Yes, the applicant should be atleast 18 years in age in order to be eligible to apply to this scheme. You are therefore eligible to apply. Can a male entrepreneur from OBC category also apply to this scheme? No, as per the latest guidelines, this scheme is not meant for male entrepreneurs. Should the project / venture need to be from a specific sector in order to be eligible for the Swarnima scheme? NBCFDC supports the economically weaker section in developing self-employment ventures only under the following sectors:
Agriculture and Allied Activities.
Small Business.
Artisan and Traditional Occupation.
Technical and Professional Trades/Courses.
Transport and Service Sector. Is there a helpline number where I can get answers for my queries reg. the application process? Yes, the Toll Free Number is 18001023399. What are SCAs? NBCFDC grants financial assistance through State Channelising Agencies (SCAs). Also, they provide funding through SCAs/ Self Help Groups (SHGs). The SCAs or Banks will release up to 50% of total funding to women with annual income up to Rs.1.50 Lakh. How do I know if a field in the application form is mandatory? The mandatory fields have a red asterisk (*) mark at the end. Sources And References Entrepreneurial Schemes Of NBCFDC Scheme Guidelines By NBCFDC Ok Was this helpful? News and Updates No new news and updates available Share Something went wrong. Please try again later. Ok You need to sign in before applying for schemes Cancel Sign In Something went wrong. Please try again later. Ok It seems you have already initiated your application earlier. To know more please visit Cancel Apply Now Check Eligibility New Swarnima Scheme For Women Ministry Of Social Justice and Empowerment Backward Class Business Empowerment Entrepreneur Financial Assistance Women Details Benefits Eligibility Application Process Documents Required Frequently Asked Questions A term loan scheme by the Ministry of Social Justice and Empowerment for women entrepreneurs from backward classes to obtain a loan of up to ₹2,00,000/- @ 5% per annum, thereby providing them social & financial security. The scheme is introduced by National Backward Classes Finance and Development Corporation (NBCFDC) and implemented by State Channelising Agencies (SCAs) which act as the nodal agency. Ok Was this helpful? Share News and Updates No new news and updates available © 2025 Powered by Digital India Corporation(DIC) Ministry of Electronics & IT (MeitY) Government of India ® Quick Links About Us Contact Us Screen Reader Accessibility Statement Frequently Asked Questions Disclaimer Terms & Conditions Useful Links Get in touch 4th Floor, NeGD, Electronics Niketan, 6 CGO Complex, Lodhi Road, New Delhi - 110003, India support-myscheme[at]digitalindia[dot]gov[dot]in (011) 24303714 Last Updated On : 07/02/2025 | v- 2.1.17", New Swarnima Scheme For Women is a loan scheme by the Ministry of Social Justice  NBCFDC grants financial assistance through State Channelising Agencies (SCAs) or  A term loan scheme by the Ministry of Social Justice and Empowerment for women entrepreneurs
https://www.myscheme.gov.in/schemes/kkjby,"Khadi Karigar Janashree Bima Yojana Are you sure you want to sign out? Cancel Sign Out | | Eng English / हिंदी Theme Sign In Back Details Benefits Eligibility Application Process Documents Required Frequently Asked Questions Sources And References Feedback Something went wrong. Please try again later. Ok You need to sign in before applying for schemes Cancel Sign In Something went wrong. Please try again later. Ok It seems you have already initiated your application earlier. To know more please visit Cancel Apply Now Check Eligibility Khadi Karigar Janashree Bima Yojana Ministry Of Micro, Small and Medium Enterprises Business Citizen Empowerment Entrepreneur Insurance Persons With Disability Details A group insurance scheme by MoMSME for khadi artisans (spinners and weavers). The scheme provides insurance cover against normal death, accidental death, permanent or partial disability of the insured artisan. Scholarships are provided to the insurer’s children studying in class 9th to 12th. ﻿ The artisan must be member of the approved vocation / occupation groups. This scheme was formulated by Khadi and Village Industries Commission (KVIC) in association with the Life Insurance Corporation of India (LIC). Benefits For death: Natural causes – ₹20,000; and Accident – ₹50,000. For permanent disability (loss of two eyes or two limbs) – ₹50,000. For partial disability (loss of one eye or one limb) – ₹25,000. Free add-on benefit : Scholarship of ₹300 per quarter for children of Khadi Karigar, studying in class 9th to 12th standard, subject to a maximum of 2 children per family Eligibility The applicant must be a Khadi Artisan (Khadi Karigar). The age of the applicant must be between 18 and 59 years. The applicant must be a member of the approved vocation/occupation groups. The group must have a minimum of 25 members. ﻿ Application Process Offline The nominee of the deceased person will have to follow the below procedure: Step 1: The beneficiary will have to furnish the original death certificate of the deceased person to the Pension Group Schemes Department of LIC of India through the Khadi Institution under which the deceased was a member. Step 2: In case of accidental deaths, the police enquiry report will also need to be submitted along with the application. Step 3: The agency will proceed further to forward the documents along with the claim records/papers to LIC as the branch which has originally finalised in the insurance cover. Step 4: The Life Insurance Corporation will settle all the claims by sending account Payee Cheque directly to the beneficiary. This intimation has to be furnished to the concerned State Government. Documents Required Proof of Age Proof of Income (Income Certificate) Proof of Occupation Aadhaar Bank Details (Aadhaar Seeded) Death Certificate / Certificate of Disability (case specific) Frequently Asked Questions What defines ‘permanent disability’ as per this scheme? For the purpose of this scheme, “permanent disability” means the loss of two eyes or two limbs. What is the maximum financial assistance provided for death due to natural causes? A financial assistance of ₹20,000 is provided for death occurring from a natural cause. Are there any benefits for the children of the applicant? Yes, there is provision for providing scholarship of ₹300 per quarter for children of a Khadi Karigar, studying in 9th to 12th standard, (subject to a maximum of 2 children per family). I am a 45 year old khadi weaver. I seek to know if I am too old to apply for the scheme? The upper age limit in this scheme is 59 yea₹ You are therefore eligible to apply. Do I need to be from a particular state in order to be eligible for this scheme? The scheme is equally applicable to citizens across all the states of India. Is partial disability covered under this scheme? Yes, partial disability, i.e. loss of one eye or one limb is completely covered in KKJBY. Is partial disability covered under this scheme? Yes, partial disability, i.e. loss of one eye or one limb is completely covered in KKJBY. By what means shall I be receiving the benefits of the scheme? The scheme is under the LIC so it will be LIC who issues the benefit to the nominee of the deceased person. I seek to know the breakup of the premium contribution? Artisan - ₹ 12.5, Khadi Institution - ₹ 25, KVIC - ₹ 12.5
Social Security Fund administered by LIC - ₹ 50. Is the application process online? At the moment, the scheme only supports offline process of application. Sources And References Guidelines Ok Was this helpful? News and Updates No new news and updates available Share Something went wrong. Please try again later. Ok You need to sign in before applying for schemes Cancel Sign In Something went wrong. Please try again later. Ok It seems you have already initiated your application earlier. To know more please visit Cancel Apply Now Check Eligibility Khadi Karigar Janashree Bima Yojana Ministry Of Micro, Small and Medium Enterprises Business Citizen Empowerment Entrepreneur Insurance Persons With Disability Details Benefits Eligibility Application Process Documents Required Frequently Asked Questions A group insurance scheme by MoMSME for khadi artisans (spinners and weavers). The scheme provides insurance cover against normal death, accidental death, permanent or partial disability of the insured artisan. Scholarships are provided to the insurer’s children studying in class 9th to 12th. ﻿ The artisan must be member of the approved vocation / occupation groups. This scheme was formulated by Khadi and Village Industries Commission (KVIC) in association with the Life Insurance Corporation of India (LIC). Ok Was this helpful? Share News and Updates No new news and updates available © 2025 Powered by Digital India Corporation(DIC) Ministry of Electronics & IT (MeitY) Government of India ® Quick Links About Us Contact Us Screen Reader Accessibility Statement Frequently Asked Questions Disclaimer Terms & Conditions Useful Links Get in touch 4th Floor, NeGD, Electronics Niketan, 6 CGO Complex, Lodhi Road, New Delhi - 110003, India support-myscheme[at]digitalindia[dot]gov[dot]in (011) 24303714 Last Updated On : 07/02/2025 | v- 2.1.17", Khadi Karigar Janashree Bima Yojana provides insurance cover against  Insurance Corporation will settle all the claims by sending account Payee Cheque directly to the  A group insurance scheme by MoMSME for khadi artisans (spinners and
https://www.myscheme.gov.in/schemes/sui,"Stand-Up India Are you sure you want to sign out? Cancel Sign Out | | Eng English / हिंदी Theme Sign In Back Details Benefits Eligibility Application Process Documents Required Frequently Asked Questions Sources And References Feedback Something went wrong. Please try again later. Ok You need to sign in before applying for schemes Cancel Sign In Something went wrong. Please try again later. Ok It seems you have already initiated your application earlier. To know more please visit Cancel Apply Now Check Eligibility Stand-Up India Ministry Of Finance Business Entrepreneur Finance Loan Details A scheme by Ministry of Finance for financing SC/ST and/or Women Entrepreneurs by facilitating bank loans for setting up a greenfield project  enterprise in manufacturing, services, trading sector and activities allied to agriculture. The objective of this scheme is to facilitate bank loans between Rs. 10 lakh and Rs. 1 Crore to at least one Scheduled Caste (SC) or Scheduled Tribe (ST) borrower and at least one woman borrower per bank branch for setting up a greenfield enterprise. In case of non-individual enterprises, at least 51% of the shareholding and controlling stake should be held by either an SC/ST or Woman entrepreneur. Benefits Facilitation of composite loan (inclusive of term loan and working capital) between ₹10 Lakhs and ₹100 Lakhs. Rupay debit card to be issued for convenience of the borrower. The web portal by SIDBI provides hand-holding support through a network of agencies engaged in training, skill development, mentoring, project report preparation, application filling, work shed / utility support services, subsidy schemes etc. Eligibility Finance is  provided for Greenfield Enterprises. If the applicant is a male, he must be from SC / ST category. The age of the applicant must be at least 18 years. The applicant must not be in default to any bank/financial institution. Application Process Online Either approach your nearest bank branch to apply (locate your nearest bank here - https://www.rbi.org.in/Scripts/query.aspx )Or Through the Lead District Manager (LDM) (find the address and the email of the LDM of your district here - https://www.standupmitra.in/LDMS#NoBack ) Or Apply Through Portal: www.standupmitra.in ﻿ Process: The first step is to visit the official portal of StandUp India at: https://www.standupmitra.in/Login/Register Enter the full details of the business location. Select the category between SC, ST, Woman, and whether the stake held is 51% or higher. Select the nature of the proposed business; the loan amount desired description of the business, the details of the premises, etc. Populate the fields with past business experience, including tenure. Select the need for hand-holding is required. Enter all the personal details sought, which include the name of the enterprise and the constitution. The last step is to select the register button to complete the process. Once you have completed registration, you are eligible to initiate the StandUp India Loan Application process with the respective financial institution for the officials to contact you for completing the StandUp India Loan Process and requisite formalities. Documents Required Proof of Identity: Voter’s ID Card / Passport / Driving License / PAN Card / Signature identification from present bankers of proprietor, partner of director ( if a company) Proof of Residence: Recent telephone bills, electricity bill, property tax receipt /Passport / voter’s ID Card of Proprietor, partner of Director (if a company) Proof of Business Address Proof that the applicant is not a defaulter in any Bank / Financial Institution Memorandum and articles of association of the Company / Partnership Deed of partners etc. Assets and liabilities statement of promoters and guarantors along with latest income tax returns. Rent Agreement (if business premises on rent) and clearance from pollution control board if applicable. SSI / MSME registration (if applicable) Projected balance sheets for the next two years in case of working capital limits and for the period of the loan in case of term loan. Photocopies of lease deeds/ title deeds of all the properties being offered as primary and collateral securities. Documents to establish whether the applicant belongs to SC/ST Category, wherever applicable. Certificate of incorporation from ROC to establish whether majority stake holding in the company is in the hands of a person who belongs to SC/ST/Woman category. For cases with exposure above ₹ 25 Lakhs: Profile of the unit (includes names of promoters, other directors in the company, the activity being undertaken addresses of all offices and plants, shareholding pattern etc. Last three years balance sheets of the Associate / Group Companies (if any). Project report (for the proposed project if term funding is required) containing details of the machinery to be acquired, from whom to be acquired, price, names of suppliers, financial details like capacity of machines, capacity of utilization assumed, production, sales, projected profit and loss and balance sheets for the tenor of the loan, the details of labour, staff to be hired, basis of assumption of such financial details etc. Manufacturing process if applicable, major profile of executives in the company, any tie-ups, details about raw material used and their suppliers, details about the buyers, details about major-competitors and the company’s strength and weaknesses as compared to their competitors etc. ﻿ Frequently Asked Questions What is the nature and size of the loan under the Stand-Up India Scheme? Composite loan (inclusive of term loan and working capital) between 10 lakh and up to 100 lakh representing up to 85% of the project cost would be eligible. How much will be the interest rate for the loan? The rate of interest would be lowest applicable rate of the bank for that category (rating category) not to exceed (base rate (MCLR) + 3%+ tenor premium). By when am I expected to repay the loan? The loan is repayable in 7 years with a maximum moratorium period of 18 months. Who are the eligible lending institutions for extending loans under the Scheme? All branches of Scheduled Commercial Banks located across the country. What is Hand-holding Support? Any new entrepreneur requires guidance in his endeavor to set up his or her business enterprise starting from training to filling up loan applications as per bank requirements. How do I get hand-holding support? You may navigate through the portal or seek assistance from the nearest branch of a Scheduled Commercial Bank  to help you identify the nature of hand-holding support required. What are the activities for which Stand-Up India loan is provided ? Stand-Up India loan may be provided to entrepreneurs for engaging in manufacturing, trading, services sectors including activities allied to agriculture. What are the activities allied to agriculture ? Under the Stand Up India loan, activities allied to agriculture include pisciculture, beekeeping, poultry, livestock, rearing, grading, sorting, aggregation  agro-industries,  dairy, fishery, agri-clinic and agri-business centres, food and agro processing etc. What is the purpose of the loan under “Stand-Up India” Scheme? The scheme is for setting up a new enterprise in manufacturing, trading,  services sector or activities allied to agriculture   by SC/ST and Women entrepreneur. What is the Difference between Stand-Up India Scheme and Start Up India Scheme? Stand-Up India Scheme is intended to support SC/ST and Women entrepreneurs to set up green field projects through bank branches in India while Start Up India Scheme aims to boost innovative and technology led enterprises for new/existing enterprises. Sources And References Guidelines Ok Was this helpful? News and Updates No new news and updates available Share Something went wrong. Please try again later. Ok You need to sign in before applying for schemes Cancel Sign In Something went wrong. Please try again later. Ok It seems you have already initiated your application earlier. To know more please visit Cancel Apply Now Check Eligibility Stand-Up India Ministry Of Finance Business Entrepreneur Finance Loan Details Benefits Eligibility Application Process Documents Required Frequently Asked Questions A scheme by Ministry of Finance for financing SC/ST and/or Women Entrepreneurs by facilitating bank loans for setting up a greenfield project  enterprise in manufacturing, services, trading sector and activities allied to agriculture. The objective of this scheme is to facilitate bank loans between Rs. 10 lakh and Rs. 1 Crore to at least one Scheduled Caste (SC) or Scheduled Tribe (ST) borrower and at least one woman borrower per bank branch for setting up a greenfield enterprise. In case of non-individual enterprises, at least 51% of the shareholding and controlling stake should be held by either an SC/ST or Woman entrepreneur. Ok Was this helpful? Share News and Updates No new news and updates available © 2025 Powered by Digital India Corporation(DIC) Ministry of Electronics & IT (MeitY) Government of India ® Quick Links About Us Contact Us Screen Reader Accessibility Statement Frequently Asked Questions Disclaimer Terms & Conditions Useful Links Get in touch 4th Floor, NeGD, Electronics Niketan, 6 CGO Complex, Lodhi Road, New Delhi - 110003, India support-myscheme[at]digitalindia[dot]gov[dot]in (011) 24303714 Last Updated On : 07/02/2025 | v- 2.1.17", Stand-Up India is a scheme by Ministry of Finance for financing SC/ST and  The last step is to select the register button to complete the process . Once you have  Stand-Up India Scheme is intended to support SC/ST and Women entrepreneurs to set  Scheme by Ministry of Finance for financing SC/ST and/or Women Entrepreneurs .
