url,content,summary
https://www.myscheme.gov.in/schemes/apy,"Atal Pension Yojana Are you sure you want to sign out? Cancel Sign Out | | Eng English / हिंदी Theme Sign In Back Details Benefits Eligibility Exclusions Application Process Documents Required Frequently Asked Questions Sources And References Feedback Something went wrong. Please try again later. Ok You need to sign in before applying for schemes Cancel Sign In Something went wrong. Please try again later. Ok It seems you have already initiated your application earlier. To know more please visit Cancel Apply Now Check Eligibility Atal Pension Yojana Ministry Of Finance Bank Account Holders Pension Unorganized Workers Details Atal Pension Yojana (APY) is an old age income security scheme for a   savings account holder in the  age group of 18-40 years who is not an income tax-payee. The scheme helps in addressing the longevity risks among the workers in the unorganized sector and encourages the workers to voluntarily save for their retirement. Focus of APY The scheme is mainly targeted at the poor, the under-privileged and workers in the  unorganized sector. APY Subscriber Contribution Chart - ﻿ https://www.npscra.nsdl.co.in/nsdl/scheme-details/APY_Subscribers_Contribution_Chart_1.pdf ﻿ ﻿ ﻿ Charges and fees and overdue interest under APY: The charges and fees and the overdue interest for non-payment or delayed payment of prescribed contribution amount shall be levied on the subscribers of APY. These charges and their method of application shall be prescribed by PFRDA from time to time, in consultation with the Central Government. Raising Grievance Under APY A subscriber can raise grievance anytime free of cost from anywhere by visiting: www.npscra.nsdl.co.in >>Home >> select: NPS-Lite or through CGMS Subscriber raising the grievance will be allotted a token number against the grievance raised. Subscriber may check the status of the grievance under “Check the status of Grievance / Enquiry already registered”. ﻿ ﻿ ﻿ ﻿ Benefits Upon exit on attaining 60 years The subscriber shall receive the following three benefits on attaining the age of 60: (i) Guaranteed minimum pension amount: Each subscriber under APY shall receive a  guaranteed minimum pension of Rs. 1000/- per month or Rs. 2000/- per month or Rs. 3000/- per month or Rs. 4000/- per month or Rs. 5000/- per month, after the age of 60 years until death. (ii) Guaranteed minimum pension amount to the spouse: After the subscriber’s demise, the spouse of the subscriber shall be entitled to receive the same pension amount as that of the subscriber,until death. (iii) Return of the pension wealth to the nominee of the subscriber: After the demise of both the subscriber and the spouse, the nominee of the subscriber shall be entitled to receive the pension wealth, as accumulated till the  subscriber's age of 60 years. Contributions to the Atal Pension Yojana (APY) are  eligible for tax benefits similar to the National Pension System (NPS) under section 80CCD(1). Voluntary exit (Exit before 60 Years of age): The subscriber shall  be refunded only the contributions made by him to APY alongwith the net actual accrued income earned on his contributions (after deducting the account maintenance charges). However, in case of subscribers who joined the scheme before 31st March 2016 and have received the Government Co-Contribution,  shall not receive the same including the   accrued  income earned thereon. For death before 60 years Option 1: In case of death of the subscriber before 60 years, option will be available to the spouse of the subscriber to continue contribution in the APY account of the subscriber, which can be maintained in the spouse’s name, for the remaining vesting period, till the original subscriber would have attained the age of 60 years. The spouse of the subscriber shall be entitled to receive the same pension amount as the subscriber until death of the spouse. Such APY account and pension amount would be in addition even if the spouse has his/her APY account and pension amount in own name. Option 2: The entire accumulated pension corpus till date under APY will be returned to the spouse / nominee. Eligibility Age of joining and contribution period The minimum age of joining APY is 18 years and maximum is 40 years. The age of exit and start of pension is 60 years. Subscriber contribution to APY shall be made through the facility of ‘auto-debit’ of the prescribed contribution amount from the savings bank account of the subscriber on monthly, quarterly or half-yearly basis. The subscribers are required to contribute the prescribed contribution amount from the age of joining APY till the age of  60 years. Exclusions From 1st October, 2022, any citizen who is or has been an income tax payer, shall  not be eligible to join  APY. Application Process Online Offline Process 1: One can also open an APY account online using one's Net banking facility. The applicant can login into his/her internet banking account and search for APY on dashboard. Customer has to fill basic and Nominee details. Customer has to give consent for  auto debit of premium from the account and submit the form. Process 2: Visit website “ https://enps.nsdl.com/eNPS/NationalPensionSystem.html “ and select “Atal Pension Yojana”. Select “APY Registration” Fill the basic details in the form. One can complete KYC through 3 options – Offline KYC – Where one has to upload XML file of Aadhaar Aadhaar – Where KYC is done through OTP verification on Mobile Number register with Aadhaar Virtual ID – Where Aadhaar virtual ID is created for KYC Citizen can select either one of three options. Once the basic details are filled, an acknowledgement number is generated. Citizen then has to fill personal details and decide the pension amount he/she wants after 60 years. The Citizen also has to decide the frequency of contribution for the scheme. Once the citizen “confirms” for personal details, he/she  has to then fill nominee details. After submitting the personal and Nominee details, Citizen is redirected to NSDL website for eSign. Once Aadhaar is OTP verified,  Citizen gets successfully registered in APY. One can also join digitally through e-APY portal or through web portal of banks providing such facility. Visit website “ https://enps.nsdl.com/eNPS/NationalPensionSystem.html “ and select “Atal Pension Yojana”. Helpline Number - - Toll Free Helpline number for APY Scheme is 1800-110-069 Documents Required KYC details are fetched from active Bank/Post Office Savings account. ﻿ Frequently Asked Questions When will I receive my Pension? Age Of Start Of Pension is  60 Years. I am a  Swavalamban subscriber. Can I still, apply for APY? Eligible Swavalamban Subscribers may be migrated to APY. Is it required to furnish nomination while joining the scheme? Yes. Is there any provision of default nominee or blood relation? If the subscriber is unmarried they can nominate any other person as nominee and they have to provide spouse details after marriage. If married, the spouse will be the default nominee. The Aadhaar details of spouse and nominees may be provided. What will happen if the contribution gets delayed? Subscriber will be charged overdue interest for the delayed period in case the APY contribution gets delayed beyond the due date. How will I know the status of my contribution? The periodical information to the subscribers regarding activation of PRAN, balance in the account, contribution credits etc. will be intimated to APY subscribers by way of SMS alerts on the registered mobile number or can be accessed through mobile/APY app launched by NSDL. The subscriber will also be receiving physical statement of account once in a financial year at their registered address. Whether Aadhaar Number is compulsory for joining the scheme? It is not mandatory as of now. Whether an employee of Central/State Government or Public Sector Undertaking and/or a NPS subscriber can subscribe to APY? APY is open to all citizens of India who have a savings bank account. The minimum age of joining APY is 18 years and maximum age is 40 years.
Provided that from 1st Oct 2022, any citizen who is or has been an income tax payer, shall not be eligible to join APY. Can I open APY Account without savings bank account? No, the savings bank account/ post office savings bank account is mandatory for joining APY. If I have completed 40 years, can I join Atal Pension Yojana? A person can join APY till his/ her 40th birthday. For example, if person ‘X’ becomes 40 years old on 1st January 2023, then, he/she is eligible to join APY till 1st January 2023 and becomes ineligible from 2nd January 2023 to join the scheme. Sources And References Scheme Guidelines APY Subscriber Contribution Chart Ok Was this helpful? News and Updates No new news and updates available Share Something went wrong. Please try again later. Ok You need to sign in before applying for schemes Cancel Sign In Something went wrong. Please try again later. Ok It seems you have already initiated your application earlier. To know more please visit Cancel Apply Now Check Eligibility Atal Pension Yojana Ministry Of Finance Bank Account Holders Pension Unorganized Workers Details Benefits Eligibility Exclusions Application Process Documents Required Frequently Asked Questions Atal Pension Yojana (APY) is an old age income security scheme for a   savings account holder in the  age group of 18-40 years who is not an income tax-payee. The scheme helps in addressing the longevity risks among the workers in the unorganized sector and encourages the workers to voluntarily save for their retirement. Focus of APY The scheme is mainly targeted at the poor, the under-privileged and workers in the  unorganized sector. APY Subscriber Contribution Chart - ﻿ https://www.npscra.nsdl.co.in/nsdl/scheme-details/APY_Subscribers_Contribution_Chart_1.pdf ﻿ ﻿ ﻿ Charges and fees and overdue interest under APY: The charges and fees and the overdue interest for non-payment or delayed payment of prescribed contribution amount shall be levied on the subscribers of APY. These charges and their method of application shall be prescribed by PFRDA from time to time, in consultation with the Central Government. Raising Grievance Under APY A subscriber can raise grievance anytime free of cost from anywhere by visiting: www.npscra.nsdl.co.in >>Home >> select: NPS-Lite or through CGMS Subscriber raising the grievance will be allotted a token number against the grievance raised. Subscriber may check the status of the grievance under “Check the status of Grievance / Enquiry already registered”. ﻿ ﻿ ﻿ ﻿ Ok Was this helpful? Share News and Updates No new news and updates available © 2025 Powered by Digital India Corporation(DIC) Ministry of Electronics & IT (MeitY) Government of India ® Quick Links About Us Contact Us Screen Reader Accessibility Statement Frequently Asked Questions Disclaimer Terms & Conditions Useful Links Get in touch 4th Floor, NeGD, Electronics Niketan, 6 CGO Complex, Lodhi Road, New Delhi - 110003, India support-myscheme[at]digitalindia[dot]gov[dot]in (011) 24303714 Last Updated On : 07/02/2025 | v- 2.1.17", Atal Pension Yojana is an old age income security scheme for a savings account  Contributions to the Atal Pension Yojana (APY) are eligible for tax  Citizen has to fill basic and Nominee details. Customer has to give consent for  Atal Pension Yojana is an old age income security scheme for a savings account  Subscriber can raise grievance anytime free of cost from anywhere by visiting www.n
https://www.myscheme.gov.in/schemes/sbm-g-i,"Swachh Bharat Mission – Grameen PHASE I Are you sure you want to sign out? Cancel Sign Out | | Eng English / हिंदी Theme Sign In Back Details Benefits Eligibility Exclusions Application Process Documents Required Frequently Asked Questions Sources And References Feedback Something went wrong. Please try again later. Ok You need to sign in before applying for schemes Cancel Sign In Something went wrong. Please try again later. Ok It seems you have already initiated your application earlier. To know more please visit Cancel Apply Now Check Eligibility Swachh Bharat Mission – Grameen PHASE I Ministry Of Jal Shakti Grameen Rural Sanitation Swachh Bharat Toilet Sign in to apply Details To accelerate the efforts to achieve universal sanitation coverage and to put the focus on sanitation, the Prime Minister of India had launched the Swachh Bharat Mission on 2nd October 2014. Under the mission, all villages, Gram Panchayats, Districts, States and Union Territories in India declared themselves ""open-defecation free"" (ODF) by 2 October 2019, the 150th birth anniversary of Mahatma Gandhi, by constructing over 100 million toilets in rural India. To ensure that the open defecation free behaviours are sustained, no one is left behind, and that solid and liquid waste management facilities are accessible, the Mission is moving towards the next Phase II of SBMG i.e ODF-Plus. ODF Plus activities under Phase II of Swachh Bharat Mission (Grameen) will reinforce ODF behaviours and focus on providing interventions for the safe management of solid and liquid waste in villages. ﻿ The Swachh Bharat Mission (Gramin) launched on 2nd October, 2014, by modifying the erstwhile Nirmal Bharat Abhiyan (NBA), is a community-led and people-oriented program aimed at universalizing safe sanitation. Swachh Bharat Mission (Gramin) is the only sanitation programme implemented by the Ministry of Drinking Water and Sanitation (now Ministry of Jal Shakti). Financial support of Rs - 12,000 for APL and BPL Rural households  including storage for handwashing and cleaning of the toilet Payment of incentives may be in cash or in the form of construction materials or credit vouchers for such materials. ﻿ Activities under the Scheme: ﻿ Construction of Individual Household Latrines (IHHL) Construction of Community Sanitary Complexes (CSCs). Solid Liquid Waste Management (SLWM) activities. Information, Education and Communication (IEC) Human Resource Development (HRD) activities. ﻿ ﻿ Order of Preference ﻿ BPL APL SC/ST Persons with disability Widow/old age pensioners Landless labourers with homestead Small farmers Marginal farmers Women headed households ﻿ ﻿ Benefits Benefits The Swachh Bharat Mission (Gramin) launched on 2nd October, 2014, by modifying the erstwhile Nirmal Bharat Abhiyan (NBA), is a community-led and people-oriented program aimed at universalizing safe sanitation. Swachh Bharat Mission (Gramin) is the only sanitation programme implemented by the Ministry of Drinking Water and Sanitation (now Ministry of Jal Shakti). Financial support of Rs - 12,000 for APL and BPL Rural households  including storage for handwashing and cleaning of the toilet Payment of incentives may be in cash or in the form of construction materials or credit vouchers for such materials. ﻿ Activities under the Scheme: ﻿ Construction of Individual Household Latrines (IHHL) Construction of Community Sanitary Complexes (CSCs). Solid Liquid Waste Management (SLWM) activities. Information, Education and Communication (IEC) Human Resource Development (HRD) activities. ﻿ ﻿ ﻿ Eligibility This scheme is for any rural household that does not have access to an individual household toilet. ﻿ Exclusions All houses constructed with the Central and/or State assistance should invariably have a safe sanitation facility as an integral part. Provision will be separately included in the Pradhan Mantri Awas Yojana – Gramin (PMAYG) for provision of functional toilets for PMAY houses. Application Process Offline Online The construction of household toilets may be undertaken by: the individual beneficiaries themselves with support from agencies. Community Model through agencies in the village. ﻿ Note: States may also decide to give the incentive to the individuals, or to communities where the model is adopted to trigger the demand in GPs/Blocks/Districts, or to the Gram Panchayats on the achievement of community objectives. Any incentive for the IHHL, provided to the community/GP, if given, shall be used only for sanitation activities. Verification : Government shall ensure that the quality of toilet is maintained through sample physical verification through its officers ﻿ ﻿ You need to sign in before applying for schemes Cancel Sign In Something went wrong. Please try again later. Ok It seems you have already initiated your application earlier. To know more please visit Cancel Apply Now Documents Required Indicative Documents Aadhar Number Bank Account Detail* - Passbook Photograph* Frequently Asked Questions No FAQs available for this Scheme Sources And References Scheme Guidelines Ok Was this helpful? This scheme is closed News and Updates No new news and updates available Share Something went wrong. Please try again later. Ok You need to sign in before applying for schemes Cancel Sign In Something went wrong. Please try again later. Ok It seems you have already initiated your application earlier. To know more please visit Cancel Apply Now Check Eligibility Swachh Bharat Mission – Grameen PHASE I Ministry Of Jal Shakti Grameen Rural Sanitation Swachh Bharat Toilet Sign in to apply Details Benefits Eligibility Exclusions Application Process Documents Required Frequently Asked Questions To accelerate the efforts to achieve universal sanitation coverage and to put the focus on sanitation, the Prime Minister of India had launched the Swachh Bharat Mission on 2nd October 2014. Under the mission, all villages, Gram Panchayats, Districts, States and Union Territories in India declared themselves ""open-defecation free"" (ODF) by 2 October 2019, the 150th birth anniversary of Mahatma Gandhi, by constructing over 100 million toilets in rural India. To ensure that the open defecation free behaviours are sustained, no one is left behind, and that solid and liquid waste management facilities are accessible, the Mission is moving towards the next Phase II of SBMG i.e ODF-Plus. ODF Plus activities under Phase II of Swachh Bharat Mission (Grameen) will reinforce ODF behaviours and focus on providing interventions for the safe management of solid and liquid waste in villages. ﻿ The Swachh Bharat Mission (Gramin) launched on 2nd October, 2014, by modifying the erstwhile Nirmal Bharat Abhiyan (NBA), is a community-led and people-oriented program aimed at universalizing safe sanitation. Swachh Bharat Mission (Gramin) is the only sanitation programme implemented by the Ministry of Drinking Water and Sanitation (now Ministry of Jal Shakti). Financial support of Rs - 12,000 for APL and BPL Rural households  including storage for handwashing and cleaning of the toilet Payment of incentives may be in cash or in the form of construction materials or credit vouchers for such materials. ﻿ Activities under the Scheme: ﻿ Construction of Individual Household Latrines (IHHL) Construction of Community Sanitary Complexes (CSCs). Solid Liquid Waste Management (SLWM) activities. Information, Education and Communication (IEC) Human Resource Development (HRD) activities. ﻿ ﻿ Order of Preference ﻿ BPL APL SC/ST Persons with disability Widow/old age pensioners Landless labourers with homestead Small farmers Marginal farmers Women headed households ﻿ ﻿ Ok Was this helpful? Share News and Updates No new news and updates available © 2025 Powered by Digital India Corporation(DIC) Ministry of Electronics & IT (MeitY) Government of India ® Quick Links About Us Contact Us Screen Reader Accessibility Statement Frequently Asked Questions Disclaimer Terms & Conditions Useful Links Get in touch 4th Floor, NeGD, Electronics Niketan, 6 CGO Complex, Lodhi Road, New Delhi - 110003, India support-myscheme[at]digitalindia[dot]gov[dot]in (011) 24303714 Last Updated On : 07/02/2025 | v- 2.1.17"," The Swachh Bharat Mission (Gramin) is the only sanitation programme  The Swachh Bharat Mission (Gramin) is the only sanitation programme  The Swachh Bharat Mission (Gramin) is the only sanitation programme  Get in touch 4th Floor, NeGD, Electronics Niketan, 6 C"
https://www.myscheme.gov.in/schemes/sbm-u,"Swachh Bharat Mission – Urban 2.0 Are you sure you want to sign out? Cancel Sign Out | | Eng English / हिंदी Theme Sign In Back Details Benefits Eligibility Application Process Documents Required Frequently Asked Questions Sources And References Feedback Something went wrong. Please try again later. Ok You need to sign in before applying for schemes Cancel Sign In Something went wrong. Please try again later. Ok It seems you have already initiated your application earlier. To know more please visit Cancel Apply Now Check Eligibility Swachh Bharat Mission – Urban 2.0 Ministry Of Housing & Urban Affairs Sanitation Toilet Sign in to apply Details A sanitation scheme for the construction of Individual Household Latrines (IHHL) for urban households. The Mission has the following components: Household toilets, including conversion of insanitary latrines into pour-flush latrines. Community toilets Public toilets Solid waste management IEC & Public Awareness Capacity building and Administrative & Office Expenses (A&OE) Benefits A Financial support of minimum Rs - 6667 (in Andhra Pradesh ,Bihar, Chhattisgarh ,Goa, Gujarat, Haryana, Jharkhand, Karnataka ,Kerala, Madhya Pradesh, Maharashtra ,Odisha, Punjab, Rajasthan, Tamil Nadu, Telangana, Uttar Pradesh, West Bengal), Rs - 12,000 (in Uttarakhand, Himachal Pradesh, Arunachal Pradesh, Manipur, Meghalaya, Mizoram, Nagaland, Sikkim, Tripura, Assam) Rs - 5333 (in Union Territories) is provided for Toilet Construction ﻿ ﻿ Eligibility Any household that does not have access to an individual household toilet ( 80% of urban households engaging in open defecation ) or has an insanitary toilet. Application Process Online Applicant creates an Applicant Login ID by registering on IHHL using Name , Mobile Number ,  Email , Address , ID Type, ID Number. After successful login the applicant enters the following details In Geographical Particulars (State, District, ULB Name, Ward No.) Toilet Owner’s Particulars (Name*, Gender*, Father/ Husband’s Name*, Mobile No*, Residential Address*, Status of Existing Toilet, Aadhar Linked Transfer of Incentive, Aadhar Number, Bank Account Detail*, Photograph*) After successful submission of Application, An IHHL Application Acknowledgement slip is generated with Application ID and Bank Account Detail ﻿ You need to sign in before applying for schemes Cancel Sign In Something went wrong. Please try again later. Ok It seems you have already initiated your application earlier. To know more please visit Cancel Apply Now Documents Required Indicative Documents Aadhar Linked Transfer of Incentive Aadhar Number Bank Account Detail - Passbook Photograph Frequently Asked Questions How will I receive my financial support under the Scheme? All financial incentives will be deposited directly (by electronic clearing service) into the bank accounts of the beneficiary households (including accounts opened under the Pradhan Mantri Jan Dhan Yojana). No cash/cheque disbursals shall take place. Will I receive the entire amount in one go if I am eligible for the scheme? No, 50% of the incentive will be released on approval by the ULB. Remaining 50% of Central Government incentive as 2nd instalment should be released to the identified beneficiary household upon verification of physical progress of construction of the household toilet. Where can I upload the picture of the toilet to claim remaining amount? You can upload the picture at http://swachhbharaturban.gov.in/ihhl/writereaddata/UserManual_ToiletPhotoUpload_CSC_ULB_Applicant.pdf Sources And References Scheme Guidelines User Manual Ok Was this helpful? News and Updates No new news and updates available Share Something went wrong. Please try again later. Ok You need to sign in before applying for schemes Cancel Sign In Something went wrong. Please try again later. Ok It seems you have already initiated your application earlier. To know more please visit Cancel Apply Now Check Eligibility Swachh Bharat Mission – Urban 2.0 Ministry Of Housing & Urban Affairs Sanitation Toilet Sign in to apply Details Benefits Eligibility Application Process Documents Required Frequently Asked Questions A sanitation scheme for the construction of Individual Household Latrines (IHHL) for urban households. The Mission has the following components: Household toilets, including conversion of insanitary latrines into pour-flush latrines. Community toilets Public toilets Solid waste management IEC & Public Awareness Capacity building and Administrative & Office Expenses (A&OE) Ok Was this helpful? Share News and Updates No new news and updates available © 2025 Powered by Digital India Corporation(DIC) Ministry of Electronics & IT (MeitY) Government of India ® Quick Links About Us Contact Us Screen Reader Accessibility Statement Frequently Asked Questions Disclaimer Terms & Conditions Useful Links Get in touch 4th Floor, NeGD, Electronics Niketan, 6 CGO Complex, Lodhi Road, New Delhi - 110003, India support-myscheme[at]digitalindia[dot]gov[dot]in (011) 24303714 Last Updated On : 07/02/2025 | v- 2.1.17"," The Mission has the following components: Household toilets, including conversion of insanitary lat  All financial incentives will be deposited directly (by electronic clearing service) into the bank accounts"
